{"$schema":"https://json-schema.org/draft/2020-12/schema","type":"object","additionalProperties":false,"required":["schema_version","packet_id","numeric_id","record_id","lane","lineage","pixel_scope","regions","structured_ocr","claims","source_evidence","rights","research","abstentions","dossier","independent_review_input","benchmark"],"properties":{"schema_version":{"const":"real_pilot_intelligence_packet_v1.0.0"},"packet_id":{"type":"string","pattern":"^real-pilot-intelligence:[a-f0-9]{24}$"},"numeric_id":{"enum":[0,10,100,101,102,105,8132,8134,8139,8143,10145,11118]},"record_id":{"type":"string","pattern":"^mtl_archives_metadata_[0-9]+\\.json$"},"lane":{"enum":["ground_ocr_entity_place","aerial_land_use_georeference"]},"lineage":{"$ref":"#/$defs/lineage"},"pixel_scope":{"$ref":"#/$defs/pixel"},"regions":{"type":"array","minItems":1,"uniqueItems":true,"items":{"$ref":"#/$defs/region"}},"structured_ocr":{"type":"array","maxItems":2,"items":{"$ref":"#/$defs/ocr"}},"claims":{"$ref":"#/$defs/claims"},"source_evidence":{"type":"array","minItems":4,"maxItems":5,"items":{"$ref":"#/$defs/evidence"}},"rights":{"$ref":"#/$defs/rights"},"research":{"$ref":"#/$defs/research"},"abstentions":{"type":"array","minItems":1,"uniqueItems":true,"items":{"type":"string","minLength":1}},"dossier":{"type":"object","additionalProperties":false,"required":["state","fully_verified"],"properties":{"state":{"const":"research_incomplete"},"fully_verified":{"const":false}}},"independent_review_input":{"type":"object","additionalProperties":false,"required":["state","reviewer_id","decision","primary_decision_digest"],"properties":{"state":{"const":"pending"},"reviewer_id":{"type":"null"},"decision":{"type":"null"},"primary_decision_digest":{"type":"null"}}},"benchmark":{"type":"object","additionalProperties":false,"required":["eligible","task_count","gold_status"],"properties":{"eligible":{"const":false},"task_count":{"const":0},"gold_status":{"const":"not_independently_corroborated"}}}},"$defs":{"hash":{"type":"string","pattern":"^[a-f0-9]{64}$"},"lineage":{"type":"object","additionalProperties":false,"required":["selection_sha256","promotion_sha256","independent_review_sha256","source_acquisition_sha256","source_acquisition_registered_tree_sha256","candidate_id","promotion_id","source_identity_sha256"],"properties":{"selection_sha256":{"$ref":"#/$defs/hash"},"promotion_sha256":{"$ref":"#/$defs/hash"},"independent_review_sha256":{"$ref":"#/$defs/hash"},"source_acquisition_sha256":{"$ref":"#/$defs/hash"},"source_acquisition_registered_tree_sha256":{"$ref":"#/$defs/hash"},"candidate_id":{"type":"string","pattern":"^real-pilot-candidate:[a-f0-9]{24}$"},"promotion_id":{"type":"string","pattern":"^real-pilot-visual-promotion:[a-f0-9]{24}$"},"source_identity_sha256":{"$ref":"#/$defs/hash"}}},"pixel":{"type":"object","additionalProperties":false,"required":["asset_class","path","sha256","width","height"],"properties":{"asset_class":{"const":"derivative_256"},"path":{"type":"string","pattern":"^docs/dataset-factory/fixtures/canonical-image-recovery-v1/inspection-derivatives/mtl_archives_metadata_[0-9]+\\.jpg$"},"sha256":{"$ref":"#/$defs/hash"},"width":{"const":256},"height":{"const":256}}},"region":{"type":"object","additionalProperties":false,"required":["region_id","kind","bbox_xyxy_norm","justification"],"properties":{"region_id":{"type":"string","pattern":"^(whole|ocr-[12])$"},"kind":{"enum":["whole_image","bbox"]},"bbox_xyxy_norm":{"oneOf":[{"type":"null"},{"type":"array","minItems":4,"maxItems":4,"items":{"type":"number","minimum":0,"maximum":1}}]},"justification":{"type":"string","minLength":20}}},"ocr":{"type":"object","additionalProperties":false,"required":["region_id","normalized_text","language","confidence","alternatives","entity_identity_status"],"properties":{"region_id":{"enum":["ocr-1","ocr-2"]},"normalized_text":{"enum":["WHITE ROSE","CASTROL"]},"language":{"const":"und"},"confidence":{"enum":["high","medium"]},"alternatives":{"type":"array","maxItems":0},"entity_identity_status":{"const":"not_verified"}}},"claim":{"type":"object","additionalProperties":false,"required":["claim_id","text","boundary","region_id","source_evidence_id","status"],"properties":{"claim_id":{"type":"string","minLength":1},"text":{"type":"string","minLength":1},"boundary":{"enum":["archive_metadata_report","visual_observation"]},"region_id":{"type":["string","null"]},"source_evidence_id":{"type":["string","null"]},"status":{"enum":["reported_not_independently_corroborated","accepted_pixel_observation"]},"field":{"type":"string","minLength":1}}},"claims":{"type":"object","additionalProperties":false,"required":["archive_metadata_report","visual_observation","inference","rejected"],"properties":{"archive_metadata_report":{"type":"array","items":{"$ref":"#/$defs/claim"}},"visual_observation":{"type":"array","minItems":1,"items":{"$ref":"#/$defs/claim"}},"inference":{"type":"array","maxItems":0},"rejected":{"type":"array","maxItems":0}}},"locator":{"oneOf":[{"type":"object","additionalProperties":false,"required":["kind","member","row_key","row_value","row_sha256"],"properties":{"kind":{"const":"csv_row"},"member":{"const":"snapshot/ground_csv.csv"},"row_key":{"const":"Cote"},"row_value":{"type":"string","minLength":1},"row_sha256":{"$ref":"#/$defs/hash"}}},{"type":"object","additionalProperties":false,"required":["kind","member","section"],"properties":{"kind":{"const":"html_member"},"member":{"enum":["snapshot/ground_page.html","snapshot/aerial_page.html","snapshot/license_page.html","snapshot/cc_by.html"]},"section":{"type":"string","minLength":1}}},{"type":"object","additionalProperties":false,"required":["kind","member","content_range","object_length"],"properties":{"kind":{"const":"byte_range_member"},"member":{"type":"string","pattern":"^snapshot/image-samples/[0-9]+\\.bin$"},"content_range":{"type":"string","pattern":"^bytes 0-4095/[0-9]+$"},"object_length":{"type":"integer","minimum":4096}}}]},"evidence":{"type":"object","additionalProperties":false,"required":["evidence_id","source_key","source_url","snapshot_path","snapshot_sha256","locator"],"properties":{"evidence_id":{"enum":["archive-row","record-image","collection-page","license-page","cc-by-4.0"]},"source_key":{"type":"string","minLength":1},"source_url":{"type":"string","pattern":"^https://[^?#]+$"},"snapshot_path":{"type":"string","pattern":"^docs/dataset-factory/fixtures/real-pilot-source-acquisition-v1/snapshot/[^.].+$"},"snapshot_sha256":{"$ref":"#/$defs/hash"},"locator":{"$ref":"#/$defs/locator"}}},"rights":{"type":"object","additionalProperties":false,"required":["license_id","attribution","commercial_use_allowed","license_evidence_ids","attribution_evidence_id","scope_note"],"properties":{"license_id":{"const":"cc-by-4.0"},"attribution":{"const":"Ville de Montréal"},"commercial_use_allowed":{"const":true},"license_evidence_ids":{"const":["license-page","cc-by-4.0"]},"attribution_evidence_id":{"enum":["archive-row","collection-page"]},"scope_note":{"type":"string","minLength":20}}},"attempt":{"type":"object","additionalProperties":false,"required":["source_evidence_id","result"],"properties":{"source_evidence_id":{"type":"string","minLength":1},"result":{"type":"string","minLength":20}}},"research":{"type":"object","additionalProperties":false,"required":["attempts","unresolved","rejected"],"properties":{"attempts":{"type":"array","minItems":4,"maxItems":5,"items":{"$ref":"#/$defs/attempt"}},"unresolved":{"type":"array","uniqueItems":true,"items":{"type":"string","minLength":1}},"rejected":{"type":"array","maxItems":0}}}}}
