{"abstentions":["airfield identity, location, scale, area, distance, and date are not pixel-verified","No exact location, measurement, area, distance, scale, georeference, entity identity, or historical claim is independently corroborated."],"benchmark":{"eligible":false,"gold_status":"not_independently_corroborated","task_count":0},"claims":{"archive_metadata_report":[],"inference":[],"rejected":[],"visual_observation":[{"boundary":"visual_observation","claim_id":"visual-1","region_id":"whole","source_evidence_id":null,"status":"accepted_pixel_observation","text":"aerial view"},{"boundary":"visual_observation","claim_id":"visual-2","region_id":"whole","source_evidence_id":null,"status":"accepted_pixel_observation","text":"runways or airfield-like linear surfaces"},{"boundary":"visual_observation","claim_id":"visual-3","region_id":"whole","source_evidence_id":null,"status":"accepted_pixel_observation","text":"roads"},{"boundary":"visual_observation","claim_id":"visual-4","region_id":"whole","source_evidence_id":null,"status":"accepted_pixel_observation","text":"mixed open and built areas"}]},"dossier":{"fully_verified":false,"state":"research_incomplete"},"independent_review_input":{"decision":null,"primary_decision_digest":null,"reviewer_id":null,"state":"pending"},"lane":"aerial_land_use_georeference","lineage":{"candidate_id":"real-pilot-candidate:406ae53425523dc4b59daf0e","independent_review_sha256":"e614092da109c9fc90802dafae1b62741669aa748323bb43b98c2ad6235513e7","promotion_id":"real-pilot-visual-promotion:6def01c1c5c867ef81537481","promotion_sha256":"8fe075ab8770891662b3b78045ea77d179455af893fdef5f68a28b4e6f2f075a","selection_sha256":"7c3729108057b374f2a108d0e3f556abcbec402d071b89268269c71340f9b96f","source_acquisition_registered_tree_sha256":"25e8d81348d0b9371af71329168bba8676115b800cdc88c9281accc7a907b2d3","source_acquisition_sha256":"4a091067c919c465c9c8940aa1dd5acc6f46e740f6ad6416acdfff101f63de10","source_identity_sha256":"f8bc34fef51963feec46bda8c4bc97e624ff6b0bd1b97d89f75f6e04c9d5899b"},"numeric_id":8134,"packet_id":"real-pilot-intelligence:406ae53425523dc4b59daf0e","pixel_scope":{"asset_class":"derivative_256","height":256,"path":"docs/dataset-factory/fixtures/canonical-image-recovery-v1/inspection-derivatives/mtl_archives_metadata_8134.jpg","sha256":"4c45c0e3308e53266c2c6aa6d2973da1029e75e115d284c4bd65e3e75c681985","width":256},"record_id":"mtl_archives_metadata_8134.json","regions":[{"bbox_xyxy_norm":null,"justification":"Explicit whole-image evidence: the scene-level observation depends on the complete bound 256x256 derivative and is not represented by a localized box.","kind":"whole_image","region_id":"whole"}],"research":{"attempts":[{"result":"Exact record-specific source-ledger image sample inspected; availability and byte-range identity only.","source_evidence_id":"record-image"},{"result":"Bound source snapshot inspected; no independent historical corroboration promoted.","source_evidence_id":"collection-page"},{"result":"Bound source snapshot inspected; no independent historical corroboration promoted.","source_evidence_id":"license-page"},{"result":"Bound source snapshot inspected; no independent historical corroboration promoted.","source_evidence_id":"cc-by-4.0"}],"rejected":[],"unresolved":["transport-pattern comparison","future georeference with external control points"]},"rights":{"attribution":"Ville de Montréal","attribution_evidence_id":"collection-page","commercial_use_allowed":true,"license_evidence_ids":["license-page","cc-by-4.0"],"license_id":"cc-by-4.0","scope_note":"Captured source evidence supports CC BY 4.0 and attribution; it does not independently corroborate image content or historical claims."},"schema_version":"real_pilot_intelligence_packet_v1.0.0","source_evidence":[{"evidence_id":"record-image","locator":{"content_range":"bytes 0-4095/108919438","kind":"byte_range_member","member":"snapshot/image-samples/8134.bin","object_length":108919438},"snapshot_path":"docs/dataset-factory/fixtures/real-pilot-source-acquisition-v1/snapshot/image-samples/8134.bin","snapshot_sha256":"23f2ba6bebcf34c827a318f9716b2233a3bdc34fdcfa2776bb6db1d84a811fdb","source_key":"image_8134","source_url":"https://depot.ville.montreal.qc.ca/vues-aeriennes-1958/VM97-3_02_10-157.TIF"},{"evidence_id":"collection-page","locator":{"kind":"html_member","member":"snapshot/aerial_page.html","section":"Photographies aériennes historiques"},"snapshot_path":"docs/dataset-factory/fixtures/real-pilot-source-acquisition-v1/snapshot/aerial_page.html","snapshot_sha256":"e26362c0f0749264dbb022c8c3c3e33def75c99de4fc0c1a6822bdf948778d21","source_key":"aerial_page","source_url":"https://donnees.montreal.ca/dataset/phototheque"},{"evidence_id":"license-page","locator":{"kind":"html_member","member":"snapshot/license_page.html","section":"Licence ouverte - attribution"},"snapshot_path":"docs/dataset-factory/fixtures/real-pilot-source-acquisition-v1/snapshot/license_page.html","snapshot_sha256":"8d5838a3b7490fae99f7e2d353fcd5c16013dc0cd37434e76e76dd2c1bcaf810","source_key":"license_page","source_url":"https://donnees.montreal.ca/pages/licence-d-utilisation"},{"evidence_id":"cc-by-4.0","locator":{"kind":"html_member","member":"snapshot/cc_by.html","section":"Creative Commons Attribution 4.0 International"},"snapshot_path":"docs/dataset-factory/fixtures/real-pilot-source-acquisition-v1/snapshot/cc_by.html","snapshot_sha256":"231a5dac65bbf135ba27145969a63cd289faadc172f1512c4810a6c60ba91036","source_key":"cc_by","source_url":"https://creativecommons.org/licenses/by/4.0/"}],"structured_ocr":[]}
