{"abstentions":["WHITE ROSE is the sole promoted transcription by policy even though CASTROL is also pixel-legible at 256px","neither WHITE ROSE nor CASTROL is promoted to a brand identity","other sign text and entities are abstained","No exact location, measurement, area, distance, scale, georeference, entity identity, or historical claim is independently corroborated."],"benchmark":{"eligible":false,"gold_status":"not_independently_corroborated","task_count":0},"claims":{"archive_metadata_report":[{"boundary":"archive_metadata_report","claim_id":"metadata-1","field":"Titre","region_id":null,"source_evidence_id":"archive-row","status":"reported_not_independently_corroborated","text":"Garage Tilden Drive Yourself et Hertz Dri-Ur-Self System (situé à l'intersection des rues Dorchester Ouest – devenu boulevard René-Lévesque Ouest - et Windsor  - devenu rue Peel)"},{"boundary":"archive_metadata_report","claim_id":"metadata-2","field":"Description","region_id":null,"source_evidence_id":"archive-row","status":"reported_not_independently_corroborated","text":"Garage spécialisé dans la location de voitures. On y voit des panneaux-réclames de White Rose Gasoline Catelli Egg Noodles fabriqués par la compagnie Claude Neon."},{"boundary":"archive_metadata_report","claim_id":"metadata-3","field":"Date","region_id":null,"source_evidence_id":"archive-row","status":"reported_not_independently_corroborated","text":"04-oct.-45"},{"boundary":"archive_metadata_report","claim_id":"metadata-4","field":"Cote","region_id":null,"source_evidence_id":"archive-row","status":"reported_not_independently_corroborated","text":"VM94,SY,SS1,SSS17,D183,P14"},{"boundary":"archive_metadata_report","claim_id":"metadata-5","field":"Fichier tif - 300 dpi","region_id":null,"source_evidence_id":"archive-row","status":"reported_not_independently_corroborated","text":"http://depot.ville.montreal.qc.ca/phototheque-archives/tiff/VM94-Z184-14.tif"},{"boundary":"archive_metadata_report","claim_id":"metadata-6","field":"Fichier jpg - 200 dpi","region_id":null,"source_evidence_id":"archive-row","status":"reported_not_independently_corroborated","text":"http://depot.ville.montreal.qc.ca/phototheque-archives/jpeg/VM94-Z184-14.jpg"},{"boundary":"archive_metadata_report","claim_id":"metadata-7","field":"Mention de crédits","region_id":null,"source_evidence_id":"archive-row","status":"reported_not_independently_corroborated","text":"Archives de la Ville de Montréal"}],"inference":[],"rejected":[],"visual_observation":[{"boundary":"visual_observation","claim_id":"visual-1","region_id":"whole","source_evidence_id":null,"status":"accepted_pixel_observation","text":"service-station-like forecourt"},{"boundary":"visual_observation","claim_id":"visual-2","region_id":"whole","source_evidence_id":null,"status":"accepted_pixel_observation","text":"large roadside signs"},{"boundary":"visual_observation","claim_id":"visual-3","region_id":"whole","source_evidence_id":null,"status":"accepted_pixel_observation","text":"pixel-legible WHITE ROSE and CASTROL text"},{"boundary":"visual_observation","claim_id":"visual-4","region_id":"whole","source_evidence_id":null,"status":"accepted_pixel_observation","text":"street traffic and pedestrians"},{"boundary":"visual_observation","claim_id":"visual-5","region_id":"whole","source_evidence_id":null,"status":"accepted_pixel_observation","text":"large industrial or commercial building"}]},"dossier":{"fully_verified":false,"state":"research_incomplete"},"independent_review_input":{"decision":null,"primary_decision_digest":null,"reviewer_id":null,"state":"pending"},"lane":"ground_ocr_entity_place","lineage":{"candidate_id":"real-pilot-candidate:5fb88775d033287f3fce1e83","independent_review_sha256":"e614092da109c9fc90802dafae1b62741669aa748323bb43b98c2ad6235513e7","promotion_id":"real-pilot-visual-promotion:341994723a456461d9a28fdf","promotion_sha256":"8fe075ab8770891662b3b78045ea77d179455af893fdef5f68a28b4e6f2f075a","selection_sha256":"7c3729108057b374f2a108d0e3f556abcbec402d071b89268269c71340f9b96f","source_acquisition_registered_tree_sha256":"25e8d81348d0b9371af71329168bba8676115b800cdc88c9281accc7a907b2d3","source_acquisition_sha256":"4a091067c919c465c9c8940aa1dd5acc6f46e740f6ad6416acdfff101f63de10","source_identity_sha256":"56387c9a45905f439257e436695d45b5359d9c0ae0e2390cc80ac817987c46f9"},"numeric_id":105,"packet_id":"real-pilot-intelligence:5fb88775d033287f3fce1e83","pixel_scope":{"asset_class":"derivative_256","height":256,"path":"docs/dataset-factory/fixtures/canonical-image-recovery-v1/inspection-derivatives/mtl_archives_metadata_105.jpg","sha256":"331886342d0ed5c71b06286bb2e45710ae4de79d15dd755d23ff7cbae10dce7f","width":256},"record_id":"mtl_archives_metadata_105.json","regions":[{"bbox_xyxy_norm":null,"justification":"Explicit whole-image evidence: the scene-level observation depends on the complete bound 256x256 derivative and is not represented by a localized box.","kind":"whole_image","region_id":"whole"},{"bbox_xyxy_norm":[0.6953125,0.515625,0.95703125,0.62109375],"justification":"Normalized bounds isolate only the defensibly legible sign surface in the exact 256x256 derivative content, with no padding or offset.","kind":"bbox","region_id":"ocr-1"},{"bbox_xyxy_norm":[0.10546875,0.43359375,0.23828125,0.48828125],"justification":"Normalized bounds isolate only the defensibly legible sign surface in the exact 256x256 derivative content, with no padding or offset.","kind":"bbox","region_id":"ocr-2"}],"research":{"attempts":[{"result":"Bound source snapshot inspected; no independent historical corroboration promoted.","source_evidence_id":"archive-row"},{"result":"Exact record-specific source-ledger image sample inspected; availability and byte-range identity only.","source_evidence_id":"record-image"},{"result":"Bound source snapshot inspected; no independent historical corroboration promoted.","source_evidence_id":"collection-page"},{"result":"Bound source snapshot inspected; no independent historical corroboration promoted.","source_evidence_id":"license-page"},{"result":"Bound source snapshot inspected; no independent historical corroboration promoted.","source_evidence_id":"cc-by-4.0"}],"rejected":[],"unresolved":["higher-resolution sign transcription","source-backed business and location verification"]},"rights":{"attribution":"Ville de Montréal","attribution_evidence_id":"archive-row","commercial_use_allowed":true,"license_evidence_ids":["license-page","cc-by-4.0"],"license_id":"cc-by-4.0","scope_note":"Captured source evidence supports CC BY 4.0 and attribution; it does not independently corroborate image content or historical claims."},"schema_version":"real_pilot_intelligence_packet_v1.0.0","source_evidence":[{"evidence_id":"archive-row","locator":{"kind":"csv_row","member":"snapshot/ground_csv.csv","row_key":"Cote","row_sha256":"80e415dd7265cf6826ab0183c3c122decd54b23291494009d0604acaef28787c","row_value":"VM94,SY,SS1,SSS17,D183,P14"},"snapshot_path":"docs/dataset-factory/fixtures/real-pilot-source-acquisition-v1/snapshot/ground_csv.csv","snapshot_sha256":"553e0d21a730f34982188c4918488174803c6fc3ee4cb69420500574165b8c2f","source_key":"ground_csv","source_url":"https://donnees.montreal.ca/fr/dataset/cc3fbf3d-f93c-479d-a807-9ae042721aba/resource/41f0cec9-2110-452e-a93d-8f29190ee2ae/download/photothequearchives.csv"},{"evidence_id":"record-image","locator":{"content_range":"bytes 0-4095/532576","kind":"byte_range_member","member":"snapshot/image-samples/105.bin","object_length":532576},"snapshot_path":"docs/dataset-factory/fixtures/real-pilot-source-acquisition-v1/snapshot/image-samples/105.bin","snapshot_sha256":"46c4601256ee149657e5e24e2b1e48469f6f21f9390cb922b528ef834b29f94c","source_key":"image_105","source_url":"https://depot.ville.montreal.qc.ca/phototheque-archives/jpeg/VM94-Z184-14.jpg"},{"evidence_id":"collection-page","locator":{"kind":"html_member","member":"snapshot/ground_page.html","section":"Photothèque des Archives de la Ville de Montréal"},"snapshot_path":"docs/dataset-factory/fixtures/real-pilot-source-acquisition-v1/snapshot/ground_page.html","snapshot_sha256":"deaa62e3a1ad38ff525a8295301df2e0b82bedf25201b59faa66f3825d406466","source_key":"ground_page","source_url":"https://donnees.montreal.ca/dataset/phototheque-archives"},{"evidence_id":"license-page","locator":{"kind":"html_member","member":"snapshot/license_page.html","section":"Licence ouverte - attribution"},"snapshot_path":"docs/dataset-factory/fixtures/real-pilot-source-acquisition-v1/snapshot/license_page.html","snapshot_sha256":"8d5838a3b7490fae99f7e2d353fcd5c16013dc0cd37434e76e76dd2c1bcaf810","source_key":"license_page","source_url":"https://donnees.montreal.ca/pages/licence-d-utilisation"},{"evidence_id":"cc-by-4.0","locator":{"kind":"html_member","member":"snapshot/cc_by.html","section":"Creative Commons Attribution 4.0 International"},"snapshot_path":"docs/dataset-factory/fixtures/real-pilot-source-acquisition-v1/snapshot/cc_by.html","snapshot_sha256":"231a5dac65bbf135ba27145969a63cd289faadc172f1512c4810a6c60ba91036","source_key":"cc_by","source_url":"https://creativecommons.org/licenses/by/4.0/"}],"structured_ocr":[{"alternatives":[],"confidence":"high","entity_identity_status":"not_verified","language":"und","normalized_text":"WHITE ROSE","region_id":"ocr-1"},{"alternatives":[],"confidence":"medium","entity_identity_status":"not_verified","language":"und","normalized_text":"CASTROL","region_id":"ocr-2"}]}
