{"abstentions":["sign text and named businesses are not reliably legible","No exact location, measurement, area, distance, scale, georeference, entity identity, or historical claim is independently corroborated."],"benchmark":{"eligible":false,"gold_status":"not_independently_corroborated","task_count":0},"claims":{"archive_metadata_report":[{"boundary":"archive_metadata_report","claim_id":"metadata-1","field":"Titre","region_id":null,"source_evidence_id":"archive-row","status":"reported_not_independently_corroborated","text":"Rue Osborne (aujourd'hui de Lagauchetière)"},{"boundary":"archive_metadata_report","claim_id":"metadata-2","field":"Description","region_id":null,"source_evidence_id":"archive-row","status":"reported_not_independently_corroborated","text":"Prise à l'angle de la rue Stanley, à partir de la gare Windsor. On y voit la maison de chambres Majestic Rooms, l'épicerie Osborne et le Laphkas Bowling Academy."},{"boundary":"archive_metadata_report","claim_id":"metadata-3","field":"Date","region_id":null,"source_evidence_id":"archive-row","status":"reported_not_independently_corroborated","text":"25-avr.-47"},{"boundary":"archive_metadata_report","claim_id":"metadata-4","field":"Cote","region_id":null,"source_evidence_id":"archive-row","status":"reported_not_independently_corroborated","text":"VM94,SY,SS1,SSS17,D180,P4"},{"boundary":"archive_metadata_report","claim_id":"metadata-5","field":"Fichier tif - 300 dpi","region_id":null,"source_evidence_id":"archive-row","status":"reported_not_independently_corroborated","text":"http://depot.ville.montreal.qc.ca/phototheque-archives/tiff/VM94-Z181-4.tif"},{"boundary":"archive_metadata_report","claim_id":"metadata-6","field":"Fichier jpg - 200 dpi","region_id":null,"source_evidence_id":"archive-row","status":"reported_not_independently_corroborated","text":"http://depot.ville.montreal.qc.ca/phototheque-archives/jpeg/VM94-Z181-4.jpg"},{"boundary":"archive_metadata_report","claim_id":"metadata-7","field":"Mention de crédits","region_id":null,"source_evidence_id":"archive-row","status":"reported_not_independently_corroborated","text":"Archives de la Ville de Montréal"}],"inference":[],"rejected":[],"visual_observation":[{"boundary":"visual_observation","claim_id":"visual-1","region_id":"whole","source_evidence_id":null,"status":"accepted_pixel_observation","text":"broad street"},{"boundary":"visual_observation","claim_id":"visual-2","region_id":"whole","source_evidence_id":null,"status":"accepted_pixel_observation","text":"row buildings"},{"boundary":"visual_observation","claim_id":"visual-3","region_id":"whole","source_evidence_id":null,"status":"accepted_pixel_observation","text":"pedestrians"},{"boundary":"visual_observation","claim_id":"visual-4","region_id":"whole","source_evidence_id":null,"status":"accepted_pixel_observation","text":"deep awning foreground"}]},"dossier":{"fully_verified":false,"state":"research_incomplete"},"independent_review_input":{"decision":null,"primary_decision_digest":null,"reviewer_id":null,"state":"pending"},"lane":"ground_ocr_entity_place","lineage":{"candidate_id":"real-pilot-candidate:378285605a3a245234fa4095","independent_review_sha256":"e614092da109c9fc90802dafae1b62741669aa748323bb43b98c2ad6235513e7","promotion_id":"real-pilot-visual-promotion:da9a854b03a99d1d5e31b400","promotion_sha256":"8fe075ab8770891662b3b78045ea77d179455af893fdef5f68a28b4e6f2f075a","selection_sha256":"7c3729108057b374f2a108d0e3f556abcbec402d071b89268269c71340f9b96f","source_acquisition_registered_tree_sha256":"25e8d81348d0b9371af71329168bba8676115b800cdc88c9281accc7a907b2d3","source_acquisition_sha256":"4a091067c919c465c9c8940aa1dd5acc6f46e740f6ad6416acdfff101f63de10","source_identity_sha256":"c6eb7155895d325c9157a59d2ee1cc5cdf4f3b237195e24c965e9724076a1d37"},"numeric_id":101,"packet_id":"real-pilot-intelligence:378285605a3a245234fa4095","pixel_scope":{"asset_class":"derivative_256","height":256,"path":"docs/dataset-factory/fixtures/canonical-image-recovery-v1/inspection-derivatives/mtl_archives_metadata_101.jpg","sha256":"9025b7e4417169df9083a076f536159811287bd94ab23d7528694498133f1753","width":256},"record_id":"mtl_archives_metadata_101.json","regions":[{"bbox_xyxy_norm":null,"justification":"Explicit whole-image evidence: the scene-level observation depends on the complete bound 256x256 derivative and is not represented by a localized box.","kind":"whole_image","region_id":"whole"}],"research":{"attempts":[{"result":"Bound source snapshot inspected; no independent historical corroboration promoted.","source_evidence_id":"archive-row"},{"result":"Exact record-specific source-ledger image sample inspected; availability and byte-range identity only.","source_evidence_id":"record-image"},{"result":"Bound source snapshot inspected; no independent historical corroboration promoted.","source_evidence_id":"collection-page"},{"result":"Bound source snapshot inspected; no independent historical corroboration promoted.","source_evidence_id":"license-page"},{"result":"Bound source snapshot inspected; no independent historical corroboration promoted.","source_evidence_id":"cc-by-4.0"}],"rejected":[],"unresolved":["storefront or streetscape comparison","source-backed location verification"]},"rights":{"attribution":"Ville de Montréal","attribution_evidence_id":"archive-row","commercial_use_allowed":true,"license_evidence_ids":["license-page","cc-by-4.0"],"license_id":"cc-by-4.0","scope_note":"Captured source evidence supports CC BY 4.0 and attribution; it does not independently corroborate image content or historical claims."},"schema_version":"real_pilot_intelligence_packet_v1.0.0","source_evidence":[{"evidence_id":"archive-row","locator":{"kind":"csv_row","member":"snapshot/ground_csv.csv","row_key":"Cote","row_sha256":"4b8840247064b69d8119db4529524a6b86c0624244d64f9fb5b262c833647d08","row_value":"VM94,SY,SS1,SSS17,D180,P4"},"snapshot_path":"docs/dataset-factory/fixtures/real-pilot-source-acquisition-v1/snapshot/ground_csv.csv","snapshot_sha256":"553e0d21a730f34982188c4918488174803c6fc3ee4cb69420500574165b8c2f","source_key":"ground_csv","source_url":"https://donnees.montreal.ca/fr/dataset/cc3fbf3d-f93c-479d-a807-9ae042721aba/resource/41f0cec9-2110-452e-a93d-8f29190ee2ae/download/photothequearchives.csv"},{"evidence_id":"record-image","locator":{"content_range":"bytes 0-4095/482044","kind":"byte_range_member","member":"snapshot/image-samples/101.bin","object_length":482044},"snapshot_path":"docs/dataset-factory/fixtures/real-pilot-source-acquisition-v1/snapshot/image-samples/101.bin","snapshot_sha256":"6b3087cd899d4906935dbaeebc817493b983d4fc865d98565b6c5f8eb5239c63","source_key":"image_101","source_url":"https://depot.ville.montreal.qc.ca/phototheque-archives/jpeg/VM94-Z181-4.jpg"},{"evidence_id":"collection-page","locator":{"kind":"html_member","member":"snapshot/ground_page.html","section":"Photothèque des Archives de la Ville de Montréal"},"snapshot_path":"docs/dataset-factory/fixtures/real-pilot-source-acquisition-v1/snapshot/ground_page.html","snapshot_sha256":"deaa62e3a1ad38ff525a8295301df2e0b82bedf25201b59faa66f3825d406466","source_key":"ground_page","source_url":"https://donnees.montreal.ca/dataset/phototheque-archives"},{"evidence_id":"license-page","locator":{"kind":"html_member","member":"snapshot/license_page.html","section":"Licence ouverte - attribution"},"snapshot_path":"docs/dataset-factory/fixtures/real-pilot-source-acquisition-v1/snapshot/license_page.html","snapshot_sha256":"8d5838a3b7490fae99f7e2d353fcd5c16013dc0cd37434e76e76dd2c1bcaf810","source_key":"license_page","source_url":"https://donnees.montreal.ca/pages/licence-d-utilisation"},{"evidence_id":"cc-by-4.0","locator":{"kind":"html_member","member":"snapshot/cc_by.html","section":"Creative Commons Attribution 4.0 International"},"snapshot_path":"docs/dataset-factory/fixtures/real-pilot-source-acquisition-v1/snapshot/cc_by.html","snapshot_sha256":"231a5dac65bbf135ba27145969a63cd289faadc172f1512c4810a6c60ba91036","source_key":"cc_by","source_url":"https://creativecommons.org/licenses/by/4.0/"}],"structured_ocr":[]}
